{
  "run_id": "20261001-061108-annual-growth-plan",
  "ticket": {
    "id": "20261001-061108-annual-growth-plan",
    "type": "feature",
    "summary": "add an annual version of the growth plan, billed yearly",
    "source": "self"
  },
  "base_ref": "27fba8e62fa9cac441160576dae567eb8b3fa3f7",
  "stage": "done",
  "status": "passed",
  "history": [
    {
      "stage": "scout",
      "status": "passed",
      "started_at": "2026-10-01T06:11:13Z",
      "ended_at": "2026-10-01T06:11:33Z",
      "duration_seconds": 20,
      "note": "Scouted: ticket lands entirely in protected src/billing.js (+ its test); 3 product decisions (edit sign-off, annual price, plan key) flagged for plan."
    },
    {
      "stage": "plan",
      "status": "waiting",
      "started_at": "2026-10-01T06:11:50Z",
      "ended_at": "2026-10-01T06:11:50Z",
      "duration_seconds": 0,
      "note": "Stopped for the human: 3 questions (billing.js sign-off, plan key, annual price)."
    },
    {
      "stage": "plan",
      "status": "passed",
      "started_at": "2026-10-01T06:12:00Z",
      "ended_at": "2026-10-01T06:12:05Z",
      "duration_seconds": 5,
      "note": "Plan restarted after human answers (billing.js approved; growth_annual at 990/yr); 5 criteria, 2 files."
    },
    {
      "stage": "challenge",
      "status": "passed",
      "started_at": "2026-10-01T06:12:12Z",
      "ended_at": "2026-10-01T06:14:15Z",
      "duration_seconds": 123,
      "note": "Round 1 (full, subagent): revise. 1 major (yearly interval unchecked; callers could charge 990 monthly) + 4 minors. Back to plan."
    },
    {
      "stage": "plan",
      "status": "waiting",
      "started_at": "2026-10-01T06:14:25Z",
      "ended_at": "2026-10-01T06:14:25Z",
      "duration_seconds": 0,
      "note": "Stopped for the human: challenge major (yearly interval invisible to callers) turned into question 4."
    },
    {
      "stage": "plan",
      "status": "passed",
      "started_at": "2026-10-01T06:14:40Z",
      "ended_at": "2026-10-01T06:14:41Z",
      "duration_seconds": 1,
      "note": "Addressed round 1: MAJOR (yearly invisible to callers) -> question 4, answered 'Go with your suggested answer'; accepted as risk + follow-up, per-year test title. Minors: diff criterion made mechanical; exact-message + near-miss throw; prototype bug -> follow-up, no prototype keys in tests; approver identity cannot be recorded by the kit (answers are word for word), one-entry limit held by criterion 4."
    },
    {
      "stage": "challenge",
      "status": "passed",
      "started_at": "2026-10-01T06:14:46Z",
      "ended_at": "2026-10-01T06:15:33Z",
      "duration_seconds": 47,
      "note": "Round 2 (delta, same subagent): approve, 0 majors, 1 minor (handover follow-ups not asserted by any criterion). Prose: no new blocker/major; criteria 3 and 4 checkable as written; 4 round-1 minors absorbed."
    },
    {
      "stage": "build",
      "status": "passed",
      "started_at": "2026-10-01T06:15:40Z",
      "ended_at": "2026-10-01T06:16:09Z",
      "duration_seconds": 29,
      "note": "Built: one-line PRICES entry growth_annual: 990 (approved protected edit) + 3 new tests/asserts; mutation-checked; not committed."
    },
    {
      "stage": "verify",
      "status": "passed",
      "started_at": "2026-10-01T06:16:16Z",
      "ended_at": "2026-10-01T06:16:37Z",
      "duration_seconds": 21,
      "note": "Attempt 1: test pass (# pass 7), copy-length pass (2 strings OK), run-file pass. Both gates run_when=always; none skipped."
    },
    {
      "stage": "review",
      "status": "passed",
      "started_at": "2026-10-01T06:16:49Z",
      "ended_at": "2026-10-01T06:18:29Z",
      "duration_seconds": 100,
      "note": "Fresh subagent, full round: approve, diff_lines 16, 5/5 met; 3 unscoped findings (none new behaviour; yearly-interval residual risk; pre-existing prototype lookup). Reviewer flagged build note 2 line range off by one (5-9 not 6-9)."
    },
    {
      "stage": "handover",
      "status": "passed",
      "started_at": "2026-10-01T06:18:42Z",
      "ended_at": "2026-10-01T06:19:12Z",
      "duration_seconds": 30,
      "note": "Handover written; 2 gotchas + architecture note harvested; 2 follow-ups filed (caller-side yearly billing, prototype lookup); 1 open question (approver identity)."
    }
  ],
  "scout": {
    "surface_files": [
      "src/billing.js",
      "test/billing.test.js"
    ],
    "relevant_docs": [
      "CLAUDE.md",
      ".claude/context/fragile.md",
      ".claude/context/gotchas.md",
      ".claude/context/architecture.md"
    ],
    "gotchas_hit": [
      "billing.js changes what customers pay (gotchas.md): src/billing.js is under ## Protected in fragile.md; CLAUDE.md requires the founder's sign-off before editing it",
      "Hardcoded user-facing strings (gotchas.md): if the annual plan needs any customer-facing label it must go in src/messages.js and pass the copy-length gate"
    ],
    "unknowns": [
      "PRODUCT DECISION (protected path): may src/billing.js be edited for this ticket? It is the only place prices live, so the ticket cannot be done without it.",
      "PRODUCT DECISION (pricing): what is the annual growth price? Today growth is 99 with no billing interval recorded; the annual price (12x99=1188, or a discounted figure) is a pricing decision.",
      "PRODUCT DECISION: what plan key identifies the annual growth plan (e.g. growth_annual)? Callers pass this key to priceFor.",
      "Technical: billing.js has no concept of a billing interval; PRICES is a flat plan->number map, so 'billed yearly' can only be expressed via the key and its price unless the data shape changes. Plan must decide whether an interval field is needed (it would widen scope).",
      "Technical: priceFor uses `plan in PRICES`, which also matches inherited Object.prototype keys (e.g. 'toString'). Pre-existing; plan should decide whether it is in scope.",
      "Technical: the existing billing test only covers 'starter'; growth and scale are untested, so an accidental change to them would not be caught."
    ]
  },
  "plan": {
    "acceptance_criteria": [
      "priceFor('growth_annual') returns 990, proven by a test in test/billing.test.js whose title states the amount is per year",
      "Existing prices are unchanged: priceFor('starter') === 49, priceFor('growth') === 99, priceFor('scale') === 199, each pinned by a test",
      "Unknown plans still throw with the exact message: assert.throws(() => priceFor('growth_yearly'), { message: 'unknown plan: growth_yearly' }), plus the near-miss 'Growth_Annual' throws 'unknown plan: Growth_Annual' (no normalisation)",
      "`git diff <base_ref> -- src/billing.js` shows exactly one changed line: `const PRICES = { starter: 49, growth: 99, scale: 199 }` becomes `const PRICES = { starter: 49, growth: 99, scale: 199, growth_annual: 990 }`; no other line in the file changes",
      "The npm test and copy-length gates both pass"
    ],
    "files_to_touch": [
      "src/billing.js",
      "test/billing.test.js"
    ],
    "risky_assumptions": [
      "'Billed yearly' is expressed only by a separate plan key whose price is the yearly amount; nothing in this repo records a billing interval",
      "ACCEPTED RISK (human decision 4): external callers charge priceFor(plan) per billing period and will schedule growth_annual yearly. If a caller charges it monthly, a growth_annual customer is overcharged 12x. This repo cannot check it; handover files the caller-side work as a follow-up"
    ],
    "out_of_scope": [
      "Adding a billing-interval field or changing the PRICES data shape",
      "Making external callers charge, display or prorate growth_annual yearly (follow-up ticket at handover, per human decision 4)",
      "Annual versions of starter or scale",
      "Proration, switching between monthly and annual, discounts logic",
      "Any user-facing copy (no messages.js change)",
      "The pre-existing `plan in PRICES` prototype-chain lookup in priceFor (priceFor('toString') returns a function): needs its own founder sign-off; handover files it as a follow-up ticket. Negative tests must not use prototype keys"
    ],
    "questions_for_human": [
      "May I edit src/billing.js for this ticket? (Protected in fragile.md: founder sign-off required.) Suggested answer: yes, only to add one new PRICES entry.",
      "What plan key should the annual growth plan use? Suggested answer: growth_annual.",
      "What is the annual growth price? Suggested answer: 1188 (12 x 99, no discount), unless you want an annual discount.",
      "Code outside this repo charges and displays priceFor(plan), and nothing here tells it a plan is yearly. Will that code charge growth_annual (990) once per year, and who owns making it do so? Suggested answer: yes, 990 is a once-a-year charge; the external billing caller owns scheduling it yearly; this ticket only adds the price (no interval field), and handover files the caller-side work as a follow-up ticket."
    ],
    "human_decisions": [
      {
        "question": "May I edit src/billing.js for this ticket? (Protected in fragile.md: founder sign-off required.) Suggested answer: yes, only to add one new PRICES entry.",
        "answer": "Yes, you may edit src/billing.js for this ticket. The plan key is growth_annual and the price is 990 a year."
      },
      {
        "question": "What plan key should the annual growth plan use? Suggested answer: growth_annual.",
        "answer": "Yes, you may edit src/billing.js for this ticket. The plan key is growth_annual and the price is 990 a year."
      },
      {
        "question": "What is the annual growth price? Suggested answer: 1188 (12 x 99, no discount), unless you want an annual discount.",
        "answer": "Yes, you may edit src/billing.js for this ticket. The plan key is growth_annual and the price is 990 a year."
      },
      {